{
  "$schema": "https://json-schema.org/draft/2020-12/schema",
  "$id": "https://openai.com/game-studio/game-spec.schema.json",
  "title": "GameSpec",
  "type": "object",
  "additionalProperties": false,
  "required": [
    "schemaVersion",
    "revision",
    "id",
    "title",
    "brief",
    "sessionLengthSeconds",
    "verbs",
    "coreLoop",
    "objective",
    "success",
    "failure",
    "actions",
    "states",
    "determinism",
    "evaluation",
    "outOfScope",
    "changes"
  ],
  "properties": {
    "schemaVersion": { "const": "0.1" },
    "revision": { "type": "integer", "minimum": 1 },
    "id": { "$ref": "#/$defs/id" },
    "title": { "type": "string", "minLength": 1 },
    "brief": { "type": "string", "minLength": 1 },
    "sessionLengthSeconds": { "type": "integer", "minimum": 10, "maximum": 1800 },
    "verbs": {
      "type": "array",
      "minItems": 1,
      "uniqueItems": true,
      "items": { "$ref": "#/$defs/id" }
    },
    "coreLoop": {
      "type": "array",
      "minItems": 2,
      "items": { "type": "string", "minLength": 1 }
    },
    "objective": { "type": "string", "minLength": 1 },
    "success": { "type": "string", "minLength": 1 },
    "failure": {
      "type": "array",
      "items": { "type": "string", "minLength": 1 }
    },
    "actions": {
      "type": "array",
      "minItems": 1,
      "items": {
        "type": "object",
        "additionalProperties": false,
        "required": ["id", "bindings", "effect"],
        "properties": {
          "id": { "$ref": "#/$defs/id" },
          "bindings": {
            "type": "array",
            "minItems": 1,
            "uniqueItems": true,
            "items": { "type": "string", "minLength": 1 }
          },
          "effect": { "type": "string", "minLength": 1 }
        }
      }
    },
    "states": {
      "type": "array",
      "minItems": 2,
      "items": {
        "type": "object",
        "additionalProperties": false,
        "required": ["id", "observableWhen"],
        "properties": {
          "id": { "$ref": "#/$defs/id" },
          "observableWhen": { "type": "string", "minLength": 1 }
        }
      }
    },
    "determinism": {
      "type": "object",
      "additionalProperties": false,
      "required": ["seed", "rng", "fixedStepMs", "resetAction", "bridge"],
      "properties": {
        "seed": { "type": "integer", "minimum": 0, "maximum": 2147483647 },
        "rng": { "type": "string", "minLength": 1 },
        "fixedStepMs": { "type": ["number", "null"], "exclusiveMinimum": 0 },
        "resetAction": { "$ref": "#/$defs/id" },
        "bridge": { "const": "window.__GAME_STUDIO__" }
      }
    },
    "evaluation": {
      "type": "object",
      "additionalProperties": false,
      "required": ["scenarioFile", "requiredScreenshots"],
      "properties": {
        "scenarioFile": { "type": "string", "minLength": 1 },
        "requiredScreenshots": {
          "type": "array",
          "minItems": 1,
          "uniqueItems": true,
          "items": { "$ref": "#/$defs/id" }
        }
      }
    },
    "outOfScope": {
      "type": "array",
      "minItems": 1,
      "items": { "type": "string", "minLength": 1 }
    },
    "changes": {
      "type": "array",
      "items": {
        "type": "object",
        "additionalProperties": false,
        "required": ["revision", "reason"],
        "properties": {
          "revision": { "type": "integer", "minimum": 2 },
          "reason": { "type": "string", "minLength": 1 }
        }
      }
    }
  },
  "$defs": {
    "id": {
      "type": "string",
      "pattern": "^[a-z0-9]+(?:-[a-z0-9]+)*$"
    }
  }
}
